{
  "contractVersion": "1.0.0",
  "description": "The pit excavation area south of the building footprint",
  "geometryRefs": [
    {
      "kind": "polygon",
      "ref": "geo-pit-outline-001"
    }
  ],
  "nodeRefs": [
    "node-site-001"
  ],
  "selectorKind": "volume",
  "units": {
    "angular": "rad",
    "linear": "m"
  }
}
