{
  "contractVersion": "1.0.0",
  "description": "The affected ground-floor wall faces",
  "geometryRefs": [
    {
      "kind": "polygon",
      "ref": "geo-wall-faces-002"
    }
  ],
  "nodeRefs": [
    "node-wall-002"
  ],
  "selectorKind": "face-set",
  "units": {
    "angular": "rad",
    "linear": "m"
  }
}
